{
  "$schema": "https://json-schema.org/draft/2020-12/schema",
  "$id": "https://github.com/0x-AO-Protocol/agent-skill-assay/skills/dev_tools/upgrade_gate/schemas/digest_request.schema.json",
  "title": "digest request (v1)",
  "description": "Documentation of the digest input. The skill enforces the same rules, the path-pattern grammar and the size caps with explicit standard-library checks in the order instructions.md documents; this schema does not express the pattern grammar, the aggregate caps or the check order.",
  "type": "object",
  "required": ["action", "as_of", "since", "watched"],
  "additionalProperties": false,
  "properties": {
    "action": {
      "const": "digest"
    },
    "as_of": {
      "type": "string",
      "pattern": "^[0-9]{4}-[0-9]{2}-[0-9]{2}$",
      "description": "The last day of the window (UTC), included to 23:59:59Z."
    },
    "since": {
      "type": "string",
      "pattern": "^[0-9]{4}-[0-9]{2}-[0-9]{2}$",
      "description": "The first day of the window (UTC), included from 00:00:00Z; not after as_of."
    },
    "watched": {
      "type": "array",
      "maxItems": 200,
      "items": {
        "type": "object",
        "required": ["repo", "events"],
        "additionalProperties": false,
        "properties": {
          "repo": {
            "type": "string",
            "pattern": "^[A-Za-z0-9_.-]{1,100}/[A-Za-z0-9_.-]{1,100}$",
            "description": "Unique among the watched repositories."
          },
          "events": {
            "type": "array",
            "maxItems": 5000,
            "items": {
              "type": "object",
              "required": ["type", "id", "at"],
              "additionalProperties": false,
              "properties": {
                "type": {
                  "type": "string",
                  "enum": ["release", "tag", "commit"]
                },
                "id": {
                  "type": "string",
                  "pattern": "^[A-Za-z0-9][A-Za-z0-9._:-]{0,63}$",
                  "description": "Unique within the repository."
                },
                "at": {
                  "type": "string",
                  "pattern": "^[0-9]{4}-[0-9]{2}-[0-9]{2}T[0-9]{2}:[0-9]{2}:[0-9]{2}Z$",
                  "description": "Before the window: dropped and counted. After it: FUTURE_EVENT."
                },
                "title": {
                  "type": "string",
                  "maxLength": 500,
                  "description": "Untrusted text: read as a version for release and tag events, scanned for breaking terms, never echoed."
                },
                "paths": {
                  "type": "array",
                  "maxItems": 500,
                  "items": {
                    "type": "string",
                    "maxLength": 1024
                  },
                  "description": "Paths a commit touched: matched against paths_of_interest, never echoed."
                }
              }
            }
          }
        }
      }
    },
    "policy": {
      "type": "object",
      "additionalProperties": false,
      "properties": {
        "paths_of_interest": {
          "type": "array",
          "maxItems": 20,
          "items": {
            "type": "string",
            "minLength": 1,
            "maxLength": 256,
            "pattern": "^[A-Za-z0-9_.\\-/*?]+$",
            "description": "A whole-path pattern over the closed character set, with ?, * and ** as wildcards; at most 4 wildcards."
          }
        }
      }
    }
  }
}
